nome,significado,origem,motivo_escolha,pesquisas
Amin,Fiel. Nome d a mãe de Maomé,Árabe,Extraído de Livro dos Nomes,0
Amina,Fiel. Amina foi a mãe de Maomé (Mahomet) fundador d o,Árabe,Extraído de Livro dos Nomes,0
Aminabad,M eu tio patern o é generos o,Hebr aico,Extraído de Livro dos Nomes,0
Aminda,Digna de ser a mada,Espera nto,Extraído de Livro dos Nomes,0
Aminon,Digno d e confianç a,Hebraic o,Extraído de Livro dos Nomes,0
Amintas,"Amyno, protetor , defensor",Grego,Extraído de Livro dos Nomes,0
Amir,Prínci pe,Ára be,Extraído de Livro dos Nomes,0
Amiron,Deus é sub lime,Hebr aico,Extraído de Livro dos Nomes,0
Ammon,"Júpiter. Hebraico: filh o do meu povo, no me de u m rei d e Judá,",Líb io,Extraído de Livro dos Nomes,0
Amonati,dista nte,Tupi,Extraído de Livro dos Nomes,0
Amorin,Origem de Gáliza,Lati m,Extraído de Livro dos Nomes,0
Amós,"O forte, o robusto",Hebraic o,Extraído de Livro dos Nomes,0
Amapro,"Manuparar e, dar a m ão ou proteger",Latim,Extraído de Livro dos Nomes,0
Ampéli o,"Ampelius, grego Ampelos, v inhedo",Latim,Extraído de Livro dos Nomes,0
Ana,"Han nah, cheia de graça, a benéfic a",Hebr aico,Extraído de Livro dos Nomes,0
Anabela,Amável,Inglês,Extraído de Livro dos Nomes,0
Anacleto,Chamado de novo,Grego,Extraído de Livro dos Nomes,1
Anael,No ocultis mo é o a njo qu e governa as sa lamandras,Grego,Extraído de Livro dos Nomes,0
Anajá,Palmeira alta,Tupi,Extraído de Livro dos Nomes,0
Anajé,Gavião,Tupi,Extraído de Livro dos Nomes,0
Anami,Nome de uma árvore,Tupi,Extraído de Livro dos Nomes,0
Ananã,"Cheiros o, fruta cheiros a, ananás, abac axi",Tupi,Extraído de Livro dos Nomes,0
Ananias,"Han aniah, o amado de De us",Hebr aico,Extraído de Livro dos Nomes,0
Anápio,"Anapius, greg o Anapias, romano q ue salvou seus pais de u ma",Lati m,Extraído de Livro dos Nomes,0
Anastácia,"Anastac ios, da ressurreiç ão",Grego,Extraído de Livro dos Nomes,0
Anatólio,"Anato lios, ho mem do or iente ou do le ste",Grego,Extraído de Livro dos Nomes,0
Anaxágoras,"Anax  + agor á (o primeiro + reu nião), o do minador d a",Grego,Extraído de Livro dos Nomes,0
Anaximandro,"Nascid o para governar , dominador",Grego,Extraído de Livro dos Nomes,0
Anchieta,Topônimo de or igem basca,Espan hol,Extraído de Livro dos Nomes,0
Ander son,Filho d e Andr é,"Germ ânico, in glês",Extraído de Livro dos Nomes,0
Andirá,"Vampiro, morcego",Tupi,Extraído de Livro dos Nomes,0
Andrade,Topônimo do reino d a Galiza,Português,Extraído de Livro dos Nomes,0
André,"Andr eas, forte, viril",Grego,Extraído de Livro dos Nomes,0
Andreoli,Sobr enome ita liano derivado de André,Italiano,Extraído de Livro dos Nomes,0
Ándrocles,"Glória de ho mem, ho mem glorioso",Grego,Extraído de Livro dos Nomes,0
Aneci,"Cheia de graça, relativo a Nanci",Francês,Extraído de Livro dos Nomes,0
Anésio,"Ánesis, repous o",Grego,Extraído de Livro dos Nomes,0
Ângela,"Ángelos (leia-s e ânguelos), me nsag eiro",Grego,Extraído de Livro dos Nomes,0
Angélica,"Angelicus, puro com o um  anjo. Conceito da m ulher",Greco-l atino,Extraído de Livro dos Nomes,0
Ângelo,"Ângelos, anjo, daí o italiano Ângelo, anjo ou m ensageiro",Grego,Extraído de Livro dos Nomes,0
Angícia,De usa dos enca ntam entos. Às vezes  confundi da com  sua irm ã,Latim,Extraído de Livro dos Nomes,0
Anhaia,Irmã o,"Espan hol, basco",Extraído de Livro dos Nomes,0
Anhangá,Só alma,Tupi,Extraído de Livro dos Nomes,0
Anhangüera,"O fantasm a, diabo consu mado, o esp ectro.  Variação:",Tupi,Extraído de Livro dos Nomes,0
Aníbal,"Graça de Baa l, dádiva  de Baal",Púnic o,Extraído de Livro dos Nomes,0
Aniceto,Invencí vel,Grego,Extraído de Livro dos Nomes,0
Anícia,Filha d e Ana,Hebr aico,Extraído de Livro dos Nomes,0
Anira,Anel,Tupi,Extraído de Livro dos Nomes,0
Anis,Amável,Árabe,Extraído de Livro dos Nomes,0
Anísio,"Completo, perfe ito",Grego,Extraído de Livro dos Nomes,0
Anjos,Sobren ome de orig em religiosa,Portug uês,Extraído de Livro dos Nomes,0
"Ann, Anne",Ana,"Ing lês, franc ês",Extraído de Livro dos Nomes,0
Ansbe rto,Bril ho dos de uses Asen,Germ ânico,Extraído de Livro dos Nomes,0
Anselmo,"Ansh elm, e lmo divino",Teutôn ico,Extraído de Livro dos Nomes,0
Antelmo,Co berto de flores,Germ ânico,Extraído de Livro dos Nomes,0
Antê mio,"Anthos, flor",Grego,Extraído de Livro dos Nomes,0
Antenor,Lutador qu e toma lugar de outro; aqu ele qu e substitui outro,Grego,Extraído de Livro dos Nomes,0
Ante ro,Cheio de flores,Grego,Extraído de Livro dos Nomes,0
Anteu,"Antai os ou Anthé us, que está na vangu arda, florid o. Giga nte",Grego,Extraído de Livro dos Nomes,0
Anthony,Antônio,Inglês,Extraído de Livro dos Nomes,0
Antídi o,Que está perante Zeus,Grego,Extraído de Livro dos Nomes,0
Antístene s,Que é contra a força,Grego,Extraído de Livro dos Nomes,0
Antoine,Antôn io,Francês,Extraído de Livro dos Nomes,0
Antônia,"Anton ia, inesti mável.  A que não tem  preço. Forma fe minina d e",Lati m,Extraído de Livro dos Nomes,0
Antoni no,Li gado a Antôni o,Latim,Extraído de Livro dos Nomes,0
Antôni o,"Antonius, in estim ável, o que nã o tem preç o. Tonho, Toninho,",Latim,Extraído de Livro dos Nomes,0
Aparício,"Apar ição. Antigamente, no Brasi l, os m eninos nasc idos no di a",Lati m,Extraído de Livro dos Nomes,0
Apiúna,Pinta do de preto,Tupi,Extraído de Livro dos Nomes,0
Apoem a,Aquele qu e enxerga longe,Tupi,Extraído de Livro dos Nomes,0
Apoli nário,"Co nsagra do a Apolo, deus da pr ocriaçã o na mitologia greco-",Latim,Extraído de Livro dos Nomes,0
Apolo,O ma is be lo dos deus es. Deus da procr iação,Lati m,Extraído de Livro dos Nomes,0
Apolo doro,Pres ente do deus gr ego Apolo,Grego,Extraído de Livro dos Nomes,0
Apolô nia,Co nsagra da a Apolo,Grego,Extraído de Livro dos Nomes,0
Apolô nio,"Apollonius, grego Apélon, o pertencente a o deus Apolo, o",Lati m,Extraído de Livro dos Nomes,0
Aprígio,Caçad or de javali,Lati m,Extraído de Livro dos Nomes,0
Aquias,"M eu irmão é Javé,  amigo de Ja vé",Hebr aico,Extraído de Livro dos Nomes,0
Áquila,"Aquila, águ ia",Lati m,Extraído de Livro dos Nomes,0
Aquiles,"Achiléus ou Achlys, lobo terrí vel. Homem de lá bios curtos e",Grego,Extraído de Livro dos Nomes,0
Aquil ina,"Aquila, águia",Latim,Extraído de Livro dos Nomes,0
Aquil ino,"Aquila, águ ia",Lati m,Extraído de Livro dos Nomes,0
Aquin o,"Nasc ido e m Aquino, Itália (Sa nto Tomás de Aquino)",Latim,Extraído de Livro dos Nomes,0
Ará,"A que an da, caminha",Hebr aico,Extraído de Livro dos Nomes,0
Arabela,"Ara-bel la, altar form oso",Latim,Extraído de Livro dos Nomes,0
Arabi,"Lindas lá grimas. Índia a mazonens e que segu ndo a le nda, chorou",Tupi,Extraído de Livro dos Nomes,0
Aracaé,Pássaro bri guento,Tupi,Extraído de Livro dos Nomes,0
Aracê,"Despo ntar, auror a",Tupi,Extraído de Livro dos Nomes,0
Aracéli,Altar do céu,tup i,Extraído de Livro dos Nomes,0
Aracema,"Saída do d ia, aurora",Tupi,Extraído de Livro dos Nomes,0
Araci,"Aracy, mão do dia, a aurora",Tupi,Extraído de Livro dos Nomes,0
Aracné,"Aran ha, na mitologia",Grego,Extraído de Livro dos Nomes,0
Aracunda,"Papag aio arrufa do ou parru do, forte",Tupi,Extraído de Livro dos Nomes,0
Aragão,"Aragó n, topô nimo de Aragón, proc edente de Aragó n",Esp anho l,Extraído de Livro dos Nomes,0
Araguarino,A água ou rio da ba ixada dos papagaios,Tupi,Extraído de Livro dos Nomes,0
Araíba,"Papag aio ou te mpo m au, tem pestad e",Tupi,Extraído de Livro dos Nomes,0
Aramis,"Oriundo d e Aramits, uma localidade dos Baixos Pirineus, na",Basco,Extraído de Livro dos Nomes,0
Aranha,"Que tece,  tece lã perfeita. Alcunha q ue ma is tarde pass ou a ser",Grego,Extraído de Livro dos Nomes,0
Arani,Tempo furioso,Tupi,Extraído de Livro dos Nomes,0
Arantes,"De Arantes, topônimo",Galeg o,Extraído de Livro dos Nomes,0
Arão,"O montanhês, o el evado, o ilu minado, o inspira do",Hebraic o,Extraído de Livro dos Nomes,0
Arapuã,Abelha qu e faz o enxu redon do,Tupi,Extraído de Livro dos Nomes,0
Araquém,"Pássar o ou tempo que dor me, dor minhoc o",Tupi,Extraído de Livro dos Nomes,0
Ararê,"Amigo dos pap agaios, páss aros",Tupi,Extraído de Livro dos Nomes,0
Arari,"Arara am arela, canindé. Nome de um a árvore e da tinta que del a se",Tupi,Extraído de Livro dos Nomes,0
Araribóia,"Cobra do rio d as araras, cobra ronca deira",Tupi,Extraído de Livro dos Nomes,0
Araripe,Rio dos pap agaios,Tupi,Extraído de Livro dos Nomes,0
Araruna,Arara preta,Tupi,Extraído de Livro dos Nomes,0
Aratama,Terra dos pa paga ios,Tupi,Extraído de Livro dos Nomes,0
Araújo,"Topônimo do galego, do castelo de Araúj a, perto do rio",Português,Extraído de Livro dos Nomes,0
Arcádio,"Arcad ius, grego Arkádi os, homens ursos, vindos d a terra d os",Lati m,Extraído de Livro dos Nomes,0
Arcângelo,O pri meiro entre os anj os,Grego,Extraído de Livro dos Nomes,0
Arco-ve rde,"Muirau bi, madeira para arco (m uíra) v erde (u bi)",Tupi,Extraído de Livro dos Nomes,0
Arduíno,Homem forte  e au daz,Teutôn ico,Extraído de Livro dos Nomes,0
Arésio,Agradável,Grego,Extraído de Livro dos Nomes,0
Argemiro,"Co mbatente,  guerreir o ilustre",Teutônico,Extraído de Livro dos Nomes,0
Argeu,"Arge ios ou Aragaios, radiante, bri lhoso",Grego,Extraído de Livro dos Nomes,0
Argos,"Brilhante, luzidio, radiante. Person agem mi tológico",Grego,Extraído de Livro dos Nomes,0
Ari,"Arih, leã o. Tupi: homem vaidoso, o cachea do",Hebraic o,Extraído de Livro dos Nomes,0
Ariadna,Nome de pers onag em da mitologia greg a que deu a se u,Grego,Extraído de Livro dos Nomes,0
Ariadne,"Ariádne, ou ori undo da i lha de Cr eta. Ari M ágne, a mu ito",Grego,Extraído de Livro dos Nomes,0
Ariana,"Ares, nome do deus da g uerra na m itologia, eq uivalente a",Grego,Extraído de Livro dos Nomes,0
Ariberto,E xército valoroso. No me d e reis da Lombardia,Germ ânico,Extraído de Livro dos Nomes,0
Aricem a,Palma que brota,Tupi,Extraído de Livro dos Nomes,0
Arícia,Princ esa ateni ense,Grego,Extraído de Livro dos Nomes,0
Arides,"Aridaios, latim Arideus, muito destruid or, guerr eiro",Grego,Extraído de Livro dos Nomes,0
Ariel,"Fogo de De us, leão de De us",Hebr aico,Extraído de Livro dos Nomes,0
Arilda,"Lar , doméstica",Germ ânico,Extraído de Livro dos Nomes,0
Arina,Alegre,Hebr aico,Extraído de Livro dos Nomes,0
Arion,"O  muito enérgico, o apressad o",Grego,Extraído de Livro dos Nomes,0
Ariosto,"Latin izado Ariovistus,  o fida lgo. Fam oso poeta ital iano, autor de",Celta,Extraído de Livro dos Nomes,0
Ariovald o,"Ariawald ou Heri + w aldan (exército +  comandar), o9",Ger mânico,Extraído de Livro dos Nomes,0
Aristágoras,"O ótim o orad or, ótim o conse lheiro",Grego,Extraído de Livro dos Nomes,0
Aristar co,Ótimo chefe,Grego,Extraído de Livro dos Nomes,0
Aristeu,"Ótim o, muito b om",Grego,Extraído de Livro dos Nomes,0
Aristides,Bril hante pe la sua ascen dênc ia,Grego,Extraído de Livro dos Nomes,0
Aristip o,O  melhor cavalo. Filósofo sensu alista,Grego,Extraído de Livro dos Nomes,0
Aristo,O me lhor,Grego,Extraído de Livro dos Nomes,0
Aristocléa o u Aristocléia,"Ilustre.  Sacer dotisa do Templo de Apolo,",Grego,Extraído de Livro dos Nomes,0
Arístocles,O  melhor e ma is rep utado,Grego,Extraído de Livro dos Nomes,0
Aristodemo,O me lhor do povo,Grego,Extraído de Livro dos Nomes,0
Aristófanes,O  que parec e ser o m elhor,Grego,Extraído de Livro dos Nomes,0
Aristófi la,Amiga das coisas no bres ou me lhores,Grego,Extraído de Livro dos Nomes,0
Aristófi lo,"Amigo do melhor, do puro, do be m esco lhido",Grego,Extraído de Livro dos Nomes,0
Ariston,O me lhor,Grego,Extraído de Livro dos Nomes,0
Aristóteles,"E xcelente confide nte, ótimo co nselh eiro",Grego,Extraído de Livro dos Nomes,0
Aritana,Nome de u m fam oso caci que da tribo,Yawalapiti,Extraído de Livro dos Nomes,0
Arlene,"Gara ntia, penhor",Celta,Extraído de Livro dos Nomes,0
Arlete,"Airleas, (pe nhor) atra vés do francês Arlette",Celta,Extraído de Livro dos Nomes,0
Arlindo,"Poderoso co mo a águia, escu do da águ ia",Teutôn ico,Extraído de Livro dos Nomes,0
Armando,"Homem do e xército, homem de armas",Teutôn ico,Extraído de Livro dos Nomes,0
Armênio,"Natural d a Armênia, terra dos m ontes az uis",Lati m,Extraído de Livro dos Nomes,0
Armina,"Har imann, guerr eira",Teutônico,Extraído de Livro dos Nomes,0
Arminda,Doc e,Germ ânica,Extraído de Livro dos Nomes,0
Armind o,"Har imann, ho mem de g uerra",Teutônico,Extraído de Livro dos Nomes,0
Armíni o,"Forte, poderoso. Nome de u m heró i germânico, uma",Ger mânico,Extraído de Livro dos Nomes,0
Arnaud,Arna ldo,Francês,Extraído de Livro dos Nomes,0
Arnóbio,Vida de C ordeiro,Grego,Extraído de Livro dos Nomes,0
Arnold,Arnaldo,"Ing lês, alemã",Extraído de Livro dos Nomes,0
Arnoldo,"Arwald, forte co mo u ma á guia",Teutôn ico,Extraído de Livro dos Nomes,0
Arnolfo,Combatente co m a cora gem da águ ia e do lob o,teutôn ico,Extraído de Livro dos Nomes,0
Arnon,"Topôn imo, Armôn, rio que d eságu a no Mar Morto",Hebraic o,Extraído de Livro dos Nomes,0
Arns,Mais usad o como sobren ome,Ger mânico,Extraído de Livro dos Nomes,0
Arnulfo,"Hari + wald (exército + comandar), o co mandante, o chefe",Ger mânico,Extraído de Livro dos Nomes,0
Aron,Luz ou il uminado,Hebr aico,Extraído de Livro dos Nomes,0
Arouche,"Procede nte de Arouche, Andaluzia",Espan hol,Extraído de Livro dos Nomes,0
Arquelau,"Guia, chefe do povo, governador do p ovo",Grego,Extraído de Livro dos Nomes,0
Arquias,"Governo, mando",Grego,Extraído de Livro dos Nomes,0
Arquibald o,"Erch an-bo ld, sagrad o, nobre e ousad o",An glo-franc o-ale mão,Extraído de Livro dos Nomes,0
Arquimede s,O  que pens a muito. Nome de um  dos ma is cél ebres,Grego,Extraído de Livro dos Nomes,0
Arrais,Ch efe de embarcaç ão,Português,Extraído de Livro dos Nomes,0
Arriaga,"Pedras enxutas,  pedras estreitas",Basco,Extraído de Livro dos Nomes,0
Arrieta,"Pedreg al, pedreira",Basco,Extraído de Livro dos Nomes,0
Arrigo,Variação de He nrique,Italiano,Extraído de Livro dos Nomes,0
Arriola,"Lugar d e pedras, oficin a de pedras",Basco,Extraído de Livro dos Nomes,0
Arroyo,Arroio,Esp anho l,Extraído de Livro dos Nomes,0
Arruda,"Nome de pl anta, lugar on de há arru da",Portug uês,Extraído de Livro dos Nomes,0
Arsênio,"Forte, viril",Grego,Extraído de Livro dos Nomes,0
Arsinoé,De forte  caráter. Nome de pr incesas egípc ias,Grego,Extraído de Livro dos Nomes,0
Arsíone,"Arsin oé, Arsínoos, espírito, ânimo varonil",Grego,Extraído de Livro dos Nomes,0
Artaxerxer,"Artahs hasa, que rei na com  justiça, que te m arte",Iran iano,Extraído de Livro dos Nomes,0
Artemidoro,"Presente de Artemis, deusa da mi tologia",Grego,Extraído de Livro dos Nomes,0
Ártemis,"Frescor , saúde, sad ia. Irmã de Apolo e fil ha de Zeus. Deusa",Grego,Extraído de Livro dos Nomes,0
Artemis a,Perfeita. No me de ra inhas,Grego,Extraído de Livro dos Nomes,0
Artigas,"Ártiga, Órtiga, castiga da, ensinada, para o basco si gnific a",Ger mânico,Extraído de Livro dos Nomes,0
Artur,"Arth-w r, o no bre, o generos o",Celta,Extraído de Livro dos Nomes,0
Arturo,Artur,Itali ano,Extraído de Livro dos Nomes,0
Aruana,"Jeitoso, hábil",Tupi,Extraído de Livro dos Nomes,0
Asael,Deus fez,Hebraic o,Extraído de Livro dos Nomes,0
Asariel,"Meu Deus li ga, meu Deus luta",Hebraic o,Extraído de Livro dos Nomes,0
Ascânio,"Campo flor ido. Planície n a Frígia. Ascânio, na m itologia, é",Grego,Extraído de Livro dos Nomes,0
Ascári,Sen hor de frei xo,Germ ânico,Extraído de Livro dos Nomes,0
Ascendi no,"Que sobe, que se e leva",Latim,Extraído de Livro dos Nomes,0
Ascenso,"Aquele que sub iu, que se elevou",Latim,Extraído de Livro dos Nomes,0
Asdrúbal,O auxiliar de Baa l,Púnic o,Extraído de Livro dos Nomes,0
Asélia,Ju menti nha,Latim,Extraído de Livro dos Nomes,0
Aselma,Divina proteç ão,Germ ânico,Extraído de Livro dos Nomes,0
Aser,Tesouro. Um dos doze filhos d e Jacó,Hebr aico,Extraído de Livro dos Nomes,0
Asileu,Deus qu e presidia ao refúgi o que Rô mulo abr ira em  Roma. Seu,Lati m,Extraído de Livro dos Nomes,0
Aspásia,"A carin hosa, aqu ela qu e recebe co m ternura",Grego,Extraído de Livro dos Nomes,0
Assad,Mais feliz,Ára be,Extraído de Livro dos Nomes,0
Assis,"Proc edente de Assis na Itália. No me d e origem religiosa, São",Latim,Extraído de Livro dos Nomes,0
Assuero,"X erxes , form a persa dess e nome greg o, famoso rei d a Pérsia",Grego,Extraído de Livro dos Nomes,0
Assunção,"Nome de m ulher, por inf luênc ia da Assunção de Maria,",Portug uês,Extraído de Livro dos Nomes,0
Assunta,"Sub ida, elevada",Latim,Extraído de Livro dos Nomes,0
Assurbaní pal,O  deus Asur de u um filho,Assírio,Extraído de Livro dos Nomes,0
Astéria,Brilhante como um astro,Grego,Extraído de Livro dos Nomes,0
Astério,Bril hante co mo u m astro,Grego,Extraído de Livro dos Nomes,0
Astolf o,"Lob o combatente, aquele que co mbate como lobo",Teutônico,Extraído de Livro dos Nomes,0
Astor,U ma ave  de rapina,Francês,Extraído de Livro dos Nomes,0
Astride,"Amazon a de lança, amazona proteg ida por d euses. Nome de",Su eco,Extraído de Livro dos Nomes,0
Astrogi ldo,Brilhante e digno d e sacrifício,Teutôn ico,Extraído de Livro dos Nomes,0
Ataíde,Pai l uta. Derivado do germânico Athanagild,Português,Extraído de Livro dos Nomes,0
Átala,Ternura,Grego,Extraído de Livro dos Nomes,0
Atalanta,"Pod eroso suporte. Fem inino de Atlas, o her ói que carr egou o",Grego,Extraído de Livro dos Nomes,0
Atália,"Elevado a Javé ou a bri lhante. Form osa rain ha de Jud á, filha",Hebr aico,Extraído de Livro dos Nomes,0
Ataliba,"Ave de fel icidade. Forma si mplificada do no me Atabal iba,",Quíchua,Extraído de Livro dos Nomes,0
Átalo,"Alegre, divertid o",Grego,Extraído de Livro dos Nomes,0
Atanagi ldo,V aloroso,Germ ânico,Extraído de Livro dos Nomes,0
Atanásia,Im ortal,Grego,Extraído de Livro dos Nomes,0
Atanásio,"Aquele qu e não mo rre, o imortal",Grego,Extraído de Livro dos Nomes,0
Ataualpa,"Atahua lpa, a ve da fel icidade, o galo",Quíchua,Extraído de Livro dos Nomes,0
Ataúlf o,"No bre como o lobo, nobre guerr eiro",Teutônico,Extraído de Livro dos Nomes,0
Atibaia,Ave sadi a. Nome de cida de de São Pau lo,Tupi,Extraído de Livro dos Nomes,0
Átila,"Atta, pai, peq ueno p ai",Gótico,Extraído de Livro dos Nomes,0
Atlas,"Lavar , carregar , sustentador",Grego,Extraído de Livro dos Nomes,0
Atos,"Intacto, ileso, incólume, livre.  Nome de um  dos Três",Grego,Extraído de Livro dos Nomes,0
Atreu,"Que nad a teme, mi tológico",Grego,Extraído de Livro dos Nomes,0
Augusta,"Nobre, gl orificad a",Lati m,Extraído de Livro dos Nomes,0
Augustin ho,"Glorificad o, nobre. Gran de doutor de Igre ja",Lati m,Extraído de Livro dos Nomes,0
Augusto,"Augustus,  dignidade m agestática,  sagrado, sub lime",Lati m,Extraído de Livro dos Nomes,0
Aulest e,"Re i dos Etruscos,  irmão de Ocno e fundad or de Perúsia, cid ade",Latim,Extraído de Livro dos Nomes,0
Aura,"Sopr o leve, perfum e. Ambiente espiritual qu e envolve cada",Latim,Extraído de Livro dos Nomes,0
Áurea,Feita ou coberta de our o,Lati m,Extraído de Livro dos Nomes,0
Aurélia,Dourada ou filh a do ouro. Deusa romana da m adrugad a,Lati m,Extraído de Livro dos Nomes,0
Aurelian o,Filh o do ouro,Latim,Extraído de Livro dos Nomes,0
Aurélio,"Úsi l, sol",Etrusco,Extraído de Livro dos Nomes,0
Aurora,"O  romper do dia, ma drugada q ue anu ncia novo dia",Latim,Extraído de Livro dos Nomes,0
Auspício,"Augúrio, pro messa",Lati m,Extraído de Livro dos Nomes,0
Aust ragésilo,"Austr + gisa l, brilhante + refé m",Germ ânico,Extraído de Livro dos Nomes,0
Auto,"Auctus,  aumentad o, acresc ido",Latim,Extraído de Livro dos Nomes,0
Autodemonte,"Autode monte, do gre go Automédon: autós: própr io, e",Latim,Extraído de Livro dos Nomes,0
Autódico,"Autód ikos, que te m juris dição própria, indepe ndente",Grego,Extraído de Livro dos Nomes,0
Autólico,"Autol ycus, do gr ego Autólykos: autós: própr io, lykos: lobos ,",Lati m,Extraído de Livro dos Nomes,0
Avaré,Homem am igo,Tupi,Extraído de Livro dos Nomes,0
Avatí,Herói de um mito indígen a,Guara ni,Extraído de Livro dos Nomes,0
Avelin o,No me de cidade italiana,Latim,Extraído de Livro dos Nomes,0
Aviano,"Avinus, nome de um  fabul ista latino",Lati m,Extraído de Livro dos Nomes,0
Avito,"Avitus, de avô, que vem do avô ou dos ante passad os",Lati m,Extraído de Livro dos Nomes,0
Áxel,"Espada, defensor p oderos o",Esca ndinavo,Extraído de Livro dos Nomes,0
Ayacá,"Cesto de vime, taquara",Tupi,Extraído de Livro dos Nomes,0
Ayala,Sen hores de Bisc aia,Esp anho l,Extraído de Livro dos Nomes,0
Ayoacy,"Jovem, mo ça, rapari ga",Tupi,Extraído de Livro dos Nomes,0
Ayra,"Sobr inho, filh o do irmão",Tupi,Extraído de Livro dos Nomes,0
Ayrosa,Ai-rosa,Espan hol,Extraído de Livro dos Nomes,0
Ayssó,"Belo, form oso, lindo",Tupi,Extraído de Livro dos Nomes,0
Azael,Deus v iu,Hebraic o,Extraído de Livro dos Nomes,0
Azaiel,M inha força é D eus,Hebr aico,Extraído de Livro dos Nomes,0
Azair,Ricco,Hebraic o,Extraído de Livro dos Nomes,0
Azaléia,"Azálea, seca. Flor que nasc e na terra seca",Grego,Extraído de Livro dos Nomes,0
Azarias,Aquele q ue o Senhor a judou,Hebr aico,Extraído de Livro dos Nomes,0
Ázem,"Reso luto, decidido",Árabe,Extraído de Livro dos Nomes,0
Azer,Auxílio,Hebr aico,Extraído de Livro dos Nomes,0
Azeredo,"Ázer e sufixo  edo, ou da Galiza, Aceredo. No me p ortuguês de",Ára be,Extraído de Livro dos Nomes,0
Azim,"Aziz, caro, estim ado, bem amado",Ára be,Extraído de Livro dos Nomes,0
Aziz,"Caro, esti mado, querid o",Árabe,Extraído de Livro dos Nomes,0
Azor,Ajudante,Hebraic o,Extraído de Livro dos Nomes,0
Bárbrio,"Babrius, do gre go Bábri os (ao lado de Babrias)",Lati m,Extraído de Livro dos Nomes,0
Bacela r,"De orig em portugues a, lugar ond e se planta m barc elos",Portug uês,Extraído de Livro dos Nomes,0
Bach,"Padeir o, morador da rib eira",Ger mânico,Extraído de Livro dos Nomes,0
Bachir,Alviçareiro,Ára be,Extraído de Livro dos Nomes,0
Bachmann,Morador ju nto à ribeira,Ger mânico,Extraído de Livro dos Nomes,0
Baco,"Bacch us, do gr ego Bákchos. Baco (e m gre go Dionísio, o deus de",Latim,Extraído de Livro dos Nomes,0
Bacuar a,"Sábio, ho mem de preparo, inte ligente",Tupi,Extraído de Livro dos Nomes,0
Badi,"Badi h, formoso",Árabe,Extraído de Livro dos Nomes,0
Bádui,"Beduíno, ho mem do deserto",Ára be,Extraído de Livro dos Nomes,0
Baena,"Proce dente de Bae na, Córdova na Espanh a",Esp anho l,Extraído de Livro dos Nomes,0
Baepeba,"O limpo, a clareira, a aberta",Tupi,Extraído de Livro dos Nomes,0
Baepend i,O que q ueres? Que cois a queres ?,Tupi,Extraído de Livro dos Nomes,0
Baeta,"Pan o de lã, algodão felp udo",Português,Extraído de Livro dos Nomes,0
Bagé,"Sozinh o, solidário",Tupi,Extraído de Livro dos Nomes,0
Bagófanes,"Bag opha nes, nome de um  persa",Latim,Extraído de Livro dos Nomes,0
Baiardo,Cabelos ruços,Francês,Extraído de Livro dos Nomes,0
Baio,"Baius, do greg o Baios, um dos companheiros de Ulisses",Lati m,Extraído de Livro dos Nomes,0
Baíra,Deus criador e civiliz ador,Tupi,Extraído de Livro dos Nomes,0
Balaão,"Bal aham, sem povo , estrangeiro",Hebreu,Extraído de Livro dos Nomes,0
Bálacro,"Bal acrus, nome de ho mem",Latim,Extraído de Livro dos Nomes,0
Balbílio,"Bal bilius, nome de ho mem",Latim,Extraído de Livro dos Nomes,0
Balbo,"Bal bus, de fala im compre ensível, aqu ele qu e balbucia",Latim,Extraído de Livro dos Nomes,0
Balboa,Vale bo m,Espan hol,Extraído de Livro dos Nomes,0
Balderico,"Baldér ic, depois Ba udry, do germânico: baldo: audaci oso,",Francês,Extraído de Livro dos Nomes,0
Baldin,Audac ioso,Italiano,Extraído de Livro dos Nomes,0
Baldomar,"Famoso, brilhante",Ger mânico,Extraído de Livro dos Nomes,0
Baldomero,"Ba ld: audaz, e me ro: famoso, brilahnte",Germ ânico,Extraído de Livro dos Nomes,0
Balduíno,"Bal dwin, amigo ousa do e protetor",Teutônico,Extraído de Livro dos Nomes,0
Baleeiro,Pescador de b aleias,Portug uês,Extraído de Livro dos Nomes,0
Bálio,"Bál ios, mosqueado  ou fogos o. Nome de u m dos cavalos de",Grego,Extraído de Livro dos Nomes,0
Baltar,"Balth ari, soldado audac ioso",Germ ânico,Extraído de Livro dos Nomes,0
Bambi,"Bambino, menino",Italiano,Extraído de Livro dos Nomes,0
Bambuí,Muito  corrente e sinuos o,Tupi,Extraído de Livro dos Nomes,0
Bandeira,Alcunha da da por Do n Afonso V ao gu erreir o Gonç alves,Portug uês,Extraído de Livro dos Nomes,0
Banôbal,"Ban o Ba'al, a quem Ba al escuta",Fenício,Extraído de Livro dos Nomes,0
Baptistela,Diminutivo de Batista,Itali ano,Extraído de Livro dos Nomes,0
Baquílides,"Bacch ylides, do grego Bakc hylides",Lati m,Extraído de Livro dos Nomes,0
Báquio,"Bacchius, do gre go Bákchi os",Lati m,Extraído de Livro dos Nomes,0
Báquis,"Bacchis, do greg o Bakchis, nome de m ulher",Lati m,Extraído de Livro dos Nomes,0
Baraquias,"Bar akiah, que Deus a benço ou",Hebraic o,Extraído de Livro dos Nomes,0
Barata,"Rixa, desavença. Usado como sobren ome",Itali ano,Extraído de Livro dos Nomes,0
Baraúna,Madeir a preta,Tupi,Extraído de Livro dos Nomes,0
Barbac ena,Aquele que tem  muita barba,Português,Extraído de Livro dos Nomes,0
Barbácio,"Barb atius,  nome de homem",Latim,Extraído de Livro dos Nomes,0
Barbalho,Barb a de alho,Português,Extraído de Livro dos Nomes,0
Bárbar a,"Estrange ira, estra nha, que ba lbucia, que gag ueja p or",Greco-l atino,Extraído de Livro dos Nomes,0
Bárbaro,"Barbarus, estrangeiro (que n ão é grego n em ro mano)",Lati m,Extraído de Livro dos Nomes,0
Barbe,Bárbara,Francês,Extraído de Livro dos Nomes,0
Barbosa,Lugar on de há mu itas árvores com b arba de bo de ou,Portug uês,Extraído de Livro dos Nomes,0
Barcas,"Fulg or, relâmpago, raio",Fenício,Extraído de Livro dos Nomes,0
